
root@lamp-s-1vcpu-1gb-tor1-01:~# clear
root@lamp-s-1vcpu-1gb-tor1-01:~# tcpdump -i eth0 tcp
tcpdump: verbose output suppressed, use -v or -vv for full protocol decode
listening on eth0, link-type EN10MB (Ethernet), capture size 262144 bytes
19:16:47.116521 IP lamp-s-1vcpu-1gb-tor1-01.ssh > 198.96.85.21.63313: Flags [P.], seq 3575676403:3575676511, ack 3367173704, win 310, length 108
19:16:47.116619 IP lamp-s-1vcpu-1gb-tor1-01.ssh > 198.96.85.21.63313: Flags [P.], seq 108:144, ack 1, win 310, length 36
19:16:47.116713 IP lamp-s-1vcpu-1gb-tor1-01.ssh > 198.96.85.21.63313: Flags [P.], seq 144:252, ack 1, win 310, length 108
19:16:47.116785 IP lamp-s-1vcpu-1gb-tor1-01.ssh > 198.96.85.21.63313: Flags [P.], seq 252:288, ack 1, win 310, length 36
19:16:47.119994 IP 198.96.85.21.63313 > lamp-s-1vcpu-1gb-tor1-01.ssh: Flags [.], ack 288, win 508, length 0
19:16:47.123436 IP lamp-s-1vcpu-1gb-tor1-01.ssh > 198.96.85.21.63313: Flags [P.], seq 288:468, ack 1, win 310, length 180
19:16:47.123534 IP lamp-s-1vcpu-1gb-tor1-01.ssh > 198.96.85.21.63313: Flags [P.], seq 468:504, ack 1, win 310, length 36
19:16:47.123643 IP lamp-s-1vcpu-1gb-tor1-01.ssh > 198.96.85.21.63313: Flags [P.], seq 504:660, ack 1, win 310, length 156
19:16:47.123814 IP lamp-s-1vcpu-1gb-tor1-01.ssh > 198.96.85.21.63313: Flags [P.], seq 696:852, ack 1, win 310, length 156
19:16:47.124033 IP lamp-s-1vcpu-1gb-tor1-01.ssh > 198.96.85.21.63313: Flags [P.], seq 888:1044, ack 1, win 310, length 156
19:16:47.124298 IP lamp-s-1vcpu-1gb-tor1-01.ssh > 198.96.85.21.63313: Flags [P.], seq 1080:1228, ack 1, win 310, length 148
19:16:47.136063 IP 198.96.85.21.63313 > lamp-s-1vcpu-1gb-tor1-01.ssh: Flags [.], ack 1264, win 512, length 0
19:16:47.136149 IP lamp-s-1vcpu-1gb-tor1-01.ssh > 198.96.85.21.63313: Flags [P.], seq 1264:2424, ack 1, win 310, length 1160
19:16:47.136400 IP lamp-s-1vcpu-1gb-tor1-01.ssh > 198.96.85.21.63313: Flags [P.], seq 2424:2572, ack 1, win 310, length 148
19:16:47.136494 IP lamp-s-1vcpu-1gb-tor1-01.ssh > 198.96.85.21.63313: Flags [P.], seq 2572:2608, ack 1, win 310, length 36
19:16:47.136647 IP lamp-s-1vcpu-1gb-tor1-01.ssh > 198.96.85.21.63313: Flags [P.], seq 2608:2772, ack 1, win 310, length 164
19:16:47.136775 IP lamp-s-1vcpu-1gb-tor1-01.ssh > 198.96.85.21.63313: Flags [P.], seq 2772:2808, ack 1, win 310, length 36
19:16:47.136966 IP lamp-s-1vcpu-1gb-tor1-01.ssh > 198.96.85.21.63313: Flags [P.], seq 2808:2972, ack 1, win 310, length 164
19:16:47.137090 IP lamp-s-1vcpu-1gb-tor1-01.ssh > 198.96.85.21.63313: Flags [P.], seq 2972:3008, ack 1, win 310, length 36
19:16:47.137263 IP lamp-s-1vcpu-1gb-tor1-01.ssh > 198.96.85.21.63313: Flags [P.], seq 3008:3164, ack 1, win 310, length 156
19:16:47.137388 IP lamp-s-1vcpu-1gb-tor1-01.ssh > 198.96.85.21.63313: Flags [P.], seq 3164:3200, ack 1, win 310, length 36
19:16:47.137552 IP lamp-s-1vcpu-1gb-tor1-01.ssh > 198.96.85.21.63313: Flags [P.], seq 3200:3364, ack 1, win 310, length 164
19:16:47.137830 IP lamp-s-1vcpu-1gb-tor1-01.ssh > 198.96.85.21.63313: Flags [P.], seq 3400:3556, ack 1, win 310, length 156
19:16:47.138147 IP lamp-s-1vcpu-1gb-tor1-01.ssh > 198.96.85.21.63313: Flags [P.], seq 3592:3756, ack 1, win 310, length 164
19:16:47.138426 IP lamp-s-1vcpu-1gb-tor1-01.ssh > 198.96.85.21.63313: Flags [P.], seq 3792:3948, ack 1, win 310, length 156
19:16:47.138684 IP lamp-s-1vcpu-1gb-tor1-01.ssh > 198.96.85.21.63313: Flags [P.], seq 3984:4148, ack 1, win 310, length 164
19:16:47.138951 IP lamp-s-1vcpu-1gb-tor1-01.ssh > 198.96.85.21.63313: Flags [P.], seq 4184:4340, ack 1, win 310, length 156
19:16:47.148658 IP 198.96.85.21.63313 > lamp-s-1vcpu-1gb-tor1-01.ssh: Flags [.], ack 4340, win 512, length 0
19:16:47.148727 IP lamp-s-1vcpu-1gb-tor1-01.ssh > 198.96.85.21.63313: Flags [P.], seq 4340:5576, ack 1, win 310, length 1236
19:16:47.148996 IP lamp-s-1vcpu-1gb-tor1-01.ssh > 198.96.85.21.63313: Flags [P.], seq 5576:5724, ack 1, win 310, length 148
19:16:47.149133 IP lamp-s-1vcpu-1gb-tor1-01.ssh > 198.96.85.21.63313: Flags [P.], seq 5724:5760, ack 1, win 310, length 36
19:16:47.149301 IP lamp-s-1vcpu-1gb-tor1-01.ssh > 198.96.85.21.63313: Flags [P.], seq 5760:5924, ack 1, win 310, length 164
19:16:47.149410 IP lamp-s-1vcpu-1gb-tor1-01.ssh > 198.96.85.21.63313: Flags [P.], seq 5924:5960, ack 1, win 310, length 36
19:16:47.149555 IP lamp-s-1vcpu-1gb-tor1-01.ssh > 198.96.85.21.63313: Flags [P.], seq 5960:6124, ack 1, win 310, length 164
19:16:47.149798 IP lamp-s-1vcpu-1gb-tor1-01.ssh > 198.96.85.21.63313: Flags [P.], seq 6124:6536, ack 1, win 310, length 412
19:16:47.150082 IP lamp-s-1vcpu-1gb-tor1-01.ssh > 198.96.85.21.63313: Flags [P.], seq 6536:6820, ack 1, win 310, length 284
19:16:47.150278 IP lamp-s-1vcpu-1gb-tor1-01.ssh > 198.96.85.21.63313: Flags [P.], seq 6820:6984, ack 1, win 310, length 164
19:16:47.150443 IP lamp-s-1vcpu-1gb-tor1-01.ssh > 198.96.85.21.63313: Flags [P.], seq 6984:7148, ack 1, win 310, length 164
19:16:47.150572 IP lamp-s-1vcpu-1gb-tor1-01.ssh > 198.96.85.21.63313: Flags [P.], seq 7148:7312, ack 1, win 310, length 164
19:16:47.150759 IP lamp-s-1vcpu-1gb-tor1-01.ssh > 198.96.85.21.63313: Flags [P.], seq 7312:7476, ack 1, win 310, length 164
19:16:47.150897 IP lamp-s-1vcpu-1gb-tor1-01.ssh > 198.96.85.21.63313: Flags [P.], seq 7476:7640, ack 1, win 310, length 164
19:16:47.151082 IP lamp-s-1vcpu-1gb-tor1-01.ssh > 198.96.85.21.63313: Flags [P.], seq 7640:7804, ack 1, win 310, length 164
19:16:47.151245 IP lamp-s-1vcpu-1gb-tor1-01.ssh > 198.96.85.21.63313: Flags [P.], seq 7804:7968, ack 1, win 310, length 164
19:16:47.151418 IP lamp-s-1vcpu-1gb-tor1-01.ssh > 198.96.85.21.63313: Flags [P.], seq 7968:8132, ack 1, win 310, length 164
19:16:47.151582 IP lamp-s-1vcpu-1gb-tor1-01.ssh > 198.96.85.21.63313: Flags [P.], seq 8132:8296, ack 1, win 310, length 164
19:16:47.151745 IP lamp-s-1vcpu-1gb-tor1-01.ssh > 198.96.85.21.63313: Flags [P.], seq 8296:8460, ack 1, win 310, length 164
19:16:47.151959 IP lamp-s-1vcpu-1gb-tor1-01.ssh > 198.96.85.21.63313: Flags [P.], seq 8460:8624, ack 1, win 310, length 164
19:16:47.152096 IP lamp-s-1vcpu-1gb-tor1-01.ssh > 198.96.85.21.63313: Flags [P.], seq 8624:8788, ack 1, win 310, length 164
19:16:47.152209 IP lamp-s-1vcpu-1gb-tor1-01.ssh > 198.96.85.21.63313: Flags [P.], seq 8788:8952, ack 1, win 310, length 164
19:16:47.152360 IP lamp-s-1vcpu-1gb-tor1-01.ssh > 198.96.85.21.63313: Flags [P.], seq 8952:9116, ack 1, win 310, length 164
19:16:47.152536 IP lamp-s-1vcpu-1gb-tor1-01.ssh > 198.96.85.21.63313: Flags [P.], seq 9116:9280, ack 1, win 310, length 164
19:16:47.152679 IP lamp-s-1vcpu-1gb-tor1-01.ssh > 198.96.85.21.63313: Flags [P.], seq 9280:9444, ack 1, win 310, length 164
19:16:47.152845 IP lamp-s-1vcpu-1gb-tor1-01.ssh > 198.96.85.21.63313: Flags [P.], seq 9444:9608, ack 1, win 310, length 164
19:16:47.152988 IP lamp-s-1vcpu-1gb-tor1-01.ssh > 198.96.85.21.63313: Flags [P.], seq 9608:9772, ack 1, win 310, length 164
19:16:47.153145 IP lamp-s-1vcpu-1gb-tor1-01.ssh > 198.96.85.21.63313: Flags [P.], seq 9772:9936, ack 1, win 310, length 164
19:16:47.153306 IP lamp-s-1vcpu-1gb-tor1-01.ssh > 198.96.85.21.63313: Flags [P.], seq 9936:10100, ack 1, win 310, length 164
19:16:47.153460 IP lamp-s-1vcpu-1gb-tor1-01.ssh > 198.96.85.21.63313: Flags [P.], seq 10100:10264, ack 1, win 310, length 164
19:16:47.153622 IP lamp-s-1vcpu-1gb-tor1-01.ssh > 198.96.85.21.63313: Flags [P.], seq 10264:10428, ack 1, win 310, length 164
19:16:47.153779 IP lamp-s-1vcpu-1gb-tor1-01.ssh > 198.96.85.21.63313: Flags [P.], seq 10428:10592, ack 1, win 310, length 164
19:16:47.153991 IP lamp-s-1vcpu-1gb-tor1-01.ssh > 198.96.85.21.63313: Flags [P.], seq 10592:10756, ack 1, win 310, length 164
19:16:47.154171 IP lamp-s-1vcpu-1gb-tor1-01.ssh > 198.96.85.21.63313: Flags [P.], seq 10756:10920, ack 1, win 310, length 164
19:16:47.154339 IP lamp-s-1vcpu-1gb-tor1-01.ssh > 198.96.85.21.63313: Flags [P.], seq 10920:11084, ack 1, win 310, length 164
19:16:47.154483 IP lamp-s-1vcpu-1gb-tor1-01.ssh > 198.96.85.21.63313: Flags [P.], seq 11084:11248, ack 1, win 310, length 164
19:16:47.154648 IP lamp-s-1vcpu-1gb-tor1-01.ssh > 198.96.85.21.63313: Flags [P.], seq 11248:11412, ack 1, win 310, length 164
19:16:47.154811 IP lamp-s-1vcpu-1gb-tor1-01.ssh > 198.96.85.21.63313: Flags [P.], seq 11412:11576, ack 1, win 310, length 164
19:16:47.154977 IP lamp-s-1vcpu-1gb-tor1-01.ssh > 198.96.85.21.63313: Flags [P.], seq 11576:11740, ack 1, win 310, length 164
19:16:47.155145 IP lamp-s-1vcpu-1gb-tor1-01.ssh > 198.96.85.21.63313: Flags [P.], seq 11740:11904, ack 1, win 310, length 164
19:16:47.155308 IP lamp-s-1vcpu-1gb-tor1-01.ssh > 198.96.85.21.63313: Flags [P.], seq 11904:12068, ack 1, win 310, length 164
19:16:47.162546 IP 198.96.85.21.63313 > lamp-s-1vcpu-1gb-tor1-01.ssh: Flags [.], ack 10756, win 512, length 0
19:16:47.162611 IP lamp-s-1vcpu-1gb-tor1-01.ssh > 198.96.85.21.63313: Flags [P.], seq 12068:12232, ack 1, win 310, length 164
19:16:47.162637 IP 198.96.85.21.63313 > lamp-s-1vcpu-1gb-tor1-01.ssh: Flags [.], ack 12068, win 512, length 0
19:16:47.162847 IP lamp-s-1vcpu-1gb-tor1-01.ssh > 198.96.85.21.63313: Flags [P.], seq 12232:12620, ack 1, win 310, length 388
19:16:47.162972 IP lamp-s-1vcpu-1gb-tor1-01.ssh > 198.96.85.21.63313: Flags [P.], seq 12620:12784, ack 1, win 310, length 164
19:16:47.163149 IP lamp-s-1vcpu-1gb-tor1-01.ssh > 198.96.85.21.63313: Flags [P.], seq 12784:12948, ack 1, win 310, length 164
19:16:47.163316 IP lamp-s-1vcpu-1gb-tor1-01.ssh > 198.96.85.21.63313: Flags [P.], seq 12948:13112, ack 1, win 310, length 164
19:16:47.163437 IP lamp-s-1vcpu-1gb-tor1-01.ssh > 198.96.85.21.63313: Flags [P.], seq 13112:13276, ack 1, win 310, length 164
19:16:47.163551 IP lamp-s-1vcpu-1gb-tor1-01.ssh > 198.96.85.21.63313: Flags [P.], seq 13276:13440, ack 1, win 310, length 164
19:16:47.163725 IP lamp-s-1vcpu-1gb-tor1-01.ssh > 198.96.85.21.63313: Flags [P.], seq 13440:13604, ack 1, win 310, length 164
19:16:47.163904 IP lamp-s-1vcpu-1gb-tor1-01.ssh > 198.96.85.21.63313: Flags [P.], seq 13604:13768, ack 1, win 310, length 164
19:16:47.164077 IP lamp-s-1vcpu-1gb-tor1-01.ssh > 198.96.85.21.63313: Flags [P.], seq 13768:13932, ack 1, win 310, length 164
19:16:47.164233 IP lamp-s-1vcpu-1gb-tor1-01.ssh > 198.96.85.21.63313: Flags [P.], seq 13932:14096, ack 1, win 310, length 164
19:16:47.164345 IP lamp-s-1vcpu-1gb-tor1-01.ssh > 198.96.85.21.63313: Flags [P.], seq 14096:14260, ack 1, win 310, length 164
19:16:47.164450 IP lamp-s-1vcpu-1gb-tor1-01.ssh > 198.96.85.21.63313: Flags [P.], seq 14260:14424, ack 1, win 310, length 164
19:16:47.164600 IP lamp-s-1vcpu-1gb-tor1-01.ssh > 198.96.85.21.63313: Flags [P.], seq 14424:14588, ack 1, win 310, length 164
19:16:47.164775 IP lamp-s-1vcpu-1gb-tor1-01.ssh > 198.96.85.21.63313: Flags [P.], seq 14588:14752, ack 1, win 310, length 164
19:16:47.164975 IP lamp-s-1vcpu-1gb-tor1-01.ssh > 198.96.85.21.63313: Flags [P.], seq 14752:14916, ack 1, win 310, length 164
19:16:47.165136 IP lamp-s-1vcpu-1gb-tor1-01.ssh > 198.96.85.21.63313: Flags [P.], seq 14916:15080, ack 1, win 310, length 164
19:16:47.165279 IP lamp-s-1vcpu-1gb-tor1-01.ssh > 198.96.85.21.63313: Flags [P.], seq 15080:15244, ack 1, win 310, length 164
19:16:47.165463 IP lamp-s-1vcpu-1gb-tor1-01.ssh > 198.96.85.21.63313: Flags [P.], seq 15244:15408, ack 1, win 310, length 164
19:16:47.165597 IP lamp-s-1vcpu-1gb-tor1-01.ssh > 198.96.85.21.63313: Flags [P.], seq 15408:15572, ack 1, win 310, length 164
19:16:47.165704 IP lamp-s-1vcpu-1gb-tor1-01.ssh > 198.96.85.21.63313: Flags [P.], seq 15572:15736, ack 1, win 310, length 164
19:16:47.165826 IP lamp-s-1vcpu-1gb-tor1-01.ssh > 198.96.85.21.63313: Flags [P.], seq 15736:15900, ack 1, win 310, length 164
19:16:47.166045 IP lamp-s-1vcpu-1gb-tor1-01.ssh > 198.96.85.21.63313: Flags [P.], seq 15900:16064, ack 1, win 310, length 164
19:16:47.166208 IP lamp-s-1vcpu-1gb-tor1-01.ssh > 198.96.85.21.63313: Flags [P.], seq 16064:16228, ack 1, win 310, length 164
19:16:47.166332 IP lamp-s-1vcpu-1gb-tor1-01.ssh > 198.96.85.21.63313: Flags [P.], seq 16228:16392, ack 1, win 310, length 164
19:16:47.166437 IP lamp-s-1vcpu-1gb-tor1-01.ssh > 198.96.85.21.63313: Flags [P.], seq 16392:16556, ack 1, win 310, length 164
19:16:47.166542 IP lamp-s-1vcpu-1gb-tor1-01.ssh > 198.96.85.21.63313: Flags [P.], seq 16556:16720, ack 1, win 310, length 164
19:16:47.166645 IP lamp-s-1vcpu-1gb-tor1-01.ssh > 198.96.85.21.63313: Flags [P.], seq 16720:16884, ack 1, win 310, length 164
19:16:47.166749 IP lamp-s-1vcpu-1gb-tor1-01.ssh > 198.96.85.21.63313: Flags [P.], seq 16884:17048, ack 1, win 310, length 164
19:16:47.166853 IP lamp-s-1vcpu-1gb-tor1-01.ssh > 198.96.85.21.63313: Flags [P.], seq 17048:17212, ack 1, win 310, length 164
19:16:47.166956 IP lamp-s-1vcpu-1gb-tor1-01.ssh > 198.96.85.21.63313: Flags [P.], seq 17212:17376, ack 1, win 310, length 164
19:16:47.167062 IP lamp-s-1vcpu-1gb-tor1-01.ssh > 198.96.85.21.63313: Flags [P.], seq 17376:17540, ack 1, win 310, length 164
19:16:47.167169 IP lamp-s-1vcpu-1gb-tor1-01.ssh > 198.96.85.21.63313: Flags [P.], seq 17540:17704, ack 1, win 310, length 164
19:16:47.167271 IP lamp-s-1vcpu-1gb-tor1-01.ssh > 198.96.85.21.63313: Flags [P.], seq 17704:17868, ack 1, win 310, length 164
19:16:47.167373 IP lamp-s-1vcpu-1gb-tor1-01.ssh > 198.96.85.21.63313: Flags [P.], seq 17868:18032, ack 1, win 310, length 164
19:16:47.167476 IP lamp-s-1vcpu-1gb-tor1-01.ssh > 198.96.85.21.63313: Flags [P.], seq 18032:18196, ack 1, win 310, length 164
19:16:47.167582 IP lamp-s-1vcpu-1gb-tor1-01.ssh > 198.96.85.21.63313: Flags [P.], seq 18196:18360, ack 1, win 310, length 164
19:16:47.167761 IP lamp-s-1vcpu-1gb-tor1-01.ssh > 198.96.85.21.63313: Flags [P.], seq 18360:18524, ack 1, win 310, length 164
19:16:47.167948 IP lamp-s-1vcpu-1gb-tor1-01.ssh > 198.96.85.21.63313: Flags [P.], seq 18524:18688, ack 1, win 310, length 164
19:16:47.168063 IP lamp-s-1vcpu-1gb-tor1-01.ssh > 198.96.85.21.63313: Flags [P.], seq 18688:18852, ack 1, win 310, length 164
19:16:47.168173 IP lamp-s-1vcpu-1gb-tor1-01.ssh > 198.96.85.21.63313: Flags [P.], seq 18852:19016, ack 1, win 310, length 164
19:16:47.168288 IP lamp-s-1vcpu-1gb-tor1-01.ssh > 198.96.85.21.63313: Flags [P.], seq 19016:19180, ack 1, win 310, length 164
19:16:47.168395 IP lamp-s-1vcpu-1gb-tor1-01.ssh > 198.96.85.21.63313: Flags [P.], seq 19180:19344, ack 1, win 310, length 164
19:16:47.168555 IP lamp-s-1vcpu-1gb-tor1-01.ssh > 198.96.85.21.63313: Flags [P.], seq 19344:19508, ack 1, win 310, length 164
19:16:47.168718 IP lamp-s-1vcpu-1gb-tor1-01.ssh > 198.96.85.21.63313: Flags [P.], seq 19508:19672, ack 1, win 310, length 164
19:16:47.168886 IP lamp-s-1vcpu-1gb-tor1-01.ssh > 198.96.85.21.63313: Flags [P.], seq 19672:19836, ack 1, win 310, length 164
19:16:47.169016 IP lamp-s-1vcpu-1gb-tor1-01.ssh > 198.96.85.21.63313: Flags [P.], seq 19836:20000, ack 1, win 310, length 164
19:16:47.169126 IP lamp-s-1vcpu-1gb-tor1-01.ssh > 198.96.85.21.63313: Flags [P.], seq 20000:20164, ack 1, win 310, length 164
19:16:47.169231 IP lamp-s-1vcpu-1gb-tor1-01.ssh > 198.96.85.21.63313: Flags [P.], seq 20164:20328, ack 1, win 310, length 164
19:16:47.169334 IP lamp-s-1vcpu-1gb-tor1-01.ssh > 198.96.85.21.63313: Flags [P.], seq 20328:20492, ack 1, win 310, length 164
19:16:47.169438 IP lamp-s-1vcpu-1gb-tor1-01.ssh > 198.96.85.21.63313: Flags [P.], seq 20492:20656, ack 1, win 310, length 164
19:16:47.169543 IP lamp-s-1vcpu-1gb-tor1-01.ssh > 198.96.85.21.63313: Flags [P.], seq 20656:20820, ack 1, win 310, length 164
19:16:47.169649 IP lamp-s-1vcpu-1gb-tor1-01.ssh > 198.96.85.21.63313: Flags [P.], seq 20820:20984, ack 1, win 310, length 164
19:16:47.169753 IP lamp-s-1vcpu-1gb-tor1-01.ssh > 198.96.85.21.63313: Flags [P.], seq 20984:21148, ack 1, win 310, length 164
19:16:47.169855 IP lamp-s-1vcpu-1gb-tor1-01.ssh > 198.96.85.21.63313: Flags [P.], seq 21148:21312, ack 1, win 310, length 164
19:16:47.169998 IP lamp-s-1vcpu-1gb-tor1-01.ssh > 198.96.85.21.63313: Flags [P.], seq 21312:21476, ack 1, win 310, length 164
19:16:47.170107 IP lamp-s-1vcpu-1gb-tor1-01.ssh > 198.96.85.21.63313: Flags [P.], seq 21476:21640, ack 1, win 310, length 164
19:16:47.170210 IP lamp-s-1vcpu-1gb-tor1-01.ssh > 198.96.85.21.63313: Flags [P.], seq 21640:21804, ack 1, win 310, length 164
19:16:47.170373 IP lamp-s-1vcpu-1gb-tor1-01.ssh > 198.96.85.21.63313: Flags [P.], seq 21804:21968, ack 1, win 310, length 164
19:16:47.170537 IP lamp-s-1vcpu-1gb-tor1-01.ssh > 198.96.85.21.63313: Flags [P.], seq 21968:22132, ack 1, win 310, length 164
19:16:47.170656 IP lamp-s-1vcpu-1gb-tor1-01.ssh > 198.96.85.21.63313: Flags [P.], seq 22132:22296, ack 1, win 310, length 164
19:16:47.170762 IP lamp-s-1vcpu-1gb-tor1-01.ssh > 198.96.85.21.63313: Flags [P.], seq 22296:22460, ack 1, win 310, length 164
19:16:47.170868 IP lamp-s-1vcpu-1gb-tor1-01.ssh > 198.96.85.21.63313: Flags [P.], seq 22460:22624, ack 1, win 310, length 164
19:16:47.171020 IP lamp-s-1vcpu-1gb-tor1-01.ssh > 198.96.85.21.63313: Flags [P.], seq 22624:22788, ack 1, win 310, length 164
19:16:47.171179 IP lamp-s-1vcpu-1gb-tor1-01.ssh > 198.96.85.21.63313: Flags [P.], seq 22788:22952, ack 1, win 310, length 164
19:16:47.171293 IP lamp-s-1vcpu-1gb-tor1-01.ssh > 198.96.85.21.63313: Flags [P.], seq 22952:23116, ack 1, win 310, length 164
19:16:47.171399 IP lamp-s-1vcpu-1gb-tor1-01.ssh > 198.96.85.21.63313: Flags [P.], seq 23116:23280, ack 1, win 310, length 164
19:16:47.171509 IP lamp-s-1vcpu-1gb-tor1-01.ssh > 198.96.85.21.63313: Flags [P.], seq 23280:23444, ack 1, win 310, length 164
19:16:47.171616 IP lamp-s-1vcpu-1gb-tor1-01.ssh > 198.96.85.21.63313: Flags [P.], seq 23444:23608, ack 1, win 310, length 164
19:16:47.171721 IP lamp-s-1vcpu-1gb-tor1-01.ssh > 198.96.85.21.63313: Flags [P.], seq 23608:23772, ack 1, win 310, length 164
19:16:47.171825 IP lamp-s-1vcpu-1gb-tor1-01.ssh > 198.96.85.21.63313: Flags [P.], seq 23772:23936, ack 1, win 310, length 164
19:16:47.171973 IP lamp-s-1vcpu-1gb-tor1-01.ssh > 198.96.85.21.63313: Flags [P.], seq 23936:24100, ack 1, win 310, length 164
19:16:47.172086 IP lamp-s-1vcpu-1gb-tor1-01.ssh > 198.96.85.21.63313: Flags [P.], seq 24100:24264, ack 1, win 310, length 164
19:16:47.172191 IP lamp-s-1vcpu-1gb-tor1-01.ssh > 198.96.85.21.63313: Flags [P.], seq 24264:24428, ack 1, win 310, length 164
19:16:47.172295 IP lamp-s-1vcpu-1gb-tor1-01.ssh > 198.96.85.21.63313: Flags [P.], seq 24428:24592, ack 1, win 310, length 164
19:16:47.172429 IP lamp-s-1vcpu-1gb-tor1-01.ssh > 198.96.85.21.63313: Flags [P.], seq 24592:24756, ack 1, win 310, length 164
19:16:47.172537 IP lamp-s-1vcpu-1gb-tor1-01.ssh > 198.96.85.21.63313: Flags [P.], seq 24756:24920, ack 1, win 310, length 164
19:16:47.172640 IP lamp-s-1vcpu-1gb-tor1-01.ssh > 198.96.85.21.63313: Flags [P.], seq 24920:25084, ack 1, win 310, length 164
19:16:47.172745 IP lamp-s-1vcpu-1gb-tor1-01.ssh > 198.96.85.21.63313: Flags [P.], seq 25084:25248, ack 1, win 310, length 164
19:16:47.172850 IP lamp-s-1vcpu-1gb-tor1-01.ssh > 198.96.85.21.63313: Flags [P.], seq 25248:25412, ack 1, win 310, length 164
19:16:47.176677 IP 198.96.85.21.63313 > lamp-s-1vcpu-1gb-tor1-01.ssh: Flags [.], ack 17212, win 512, length 0
19:16:47.176739 IP lamp-s-1vcpu-1gb-tor1-01.ssh > 198.96.85.21.63313: Flags [P.], seq 25412:25576, ack 1, win 310, length 164
19:16:47.176768 IP 198.96.85.21.63313 > lamp-s-1vcpu-1gb-tor1-01.ssh: Flags [.], ack 22460, win 512, length 0
19:16:47.176797 IP 198.96.85.21.63313 > lamp-s-1vcpu-1gb-tor1-01.ssh: Flags [.], ack 25084, win 512, length 0
19:16:47.177044 IP lamp-s-1vcpu-1gb-tor1-01.ssh > 198.96.85.21.63313: Flags [P.], seq 25576:26076, ack 1, win 310, length 500
19:16:47.177171 IP lamp-s-1vcpu-1gb-tor1-01.ssh > 198.96.85.21.63313: Flags [P.], seq 26076:26240, ack 1, win 310, length 164
19:16:47.177285 IP lamp-s-1vcpu-1gb-tor1-01.ssh > 198.96.85.21.63313: Flags [P.], seq 26240:26404, ack 1, win 310, length 164
19:16:47.177391 IP lamp-s-1vcpu-1gb-tor1-01.ssh > 198.96.85.21.63313: Flags [P.], seq 26404:26568, ack 1, win 310, length 164
19:16:47.177494 IP lamp-s-1vcpu-1gb-tor1-01.ssh > 198.96.85.21.63313: Flags [P.], seq 26568:26732, ack 1, win 310, length 164
19:16:47.177596 IP lamp-s-1vcpu-1gb-tor1-01.ssh > 198.96.85.21.63313: Flags [P.], seq 26732:26896, ack 1, win 310, length 164
19:16:47.177698 IP lamp-s-1vcpu-1gb-tor1-01.ssh > 198.96.85.21.63313: Flags [P.], seq 26896:27060, ack 1, win 310, length 164
19:16:47.177802 IP lamp-s-1vcpu-1gb-tor1-01.ssh > 198.96.85.21.63313: Flags [P.], seq 27060:27224, ack 1, win 310, length 164
19:16:47.177937 IP lamp-s-1vcpu-1gb-tor1-01.ssh > 198.96.85.21.63313: Flags [P.], seq 27224:27388, ack 1, win 310, length 164
19:16:47.178048 IP lamp-s-1vcpu-1gb-tor1-01.ssh > 198.96.85.21.63313: Flags [P.], seq 27388:27552, ack 1, win 310, length 164
19:16:47.178153 IP lamp-s-1vcpu-1gb-tor1-01.ssh > 198.96.85.21.63313: Flags [P.], seq 27552:27716, ack 1, win 310, length 164
19:16:47.178257 IP lamp-s-1vcpu-1gb-tor1-01.ssh > 198.96.85.21.63313: Flags [P.], seq 27716:27880, ack 1, win 310, length 164
19:16:47.178361 IP lamp-s-1vcpu-1gb-tor1-01.ssh > 198.96.85.21.63313: Flags [P.], seq 27880:28044, ack 1, win 310, length 164
19:16:47.178463 IP lamp-s-1vcpu-1gb-tor1-01.ssh > 198.96.85.21.63313: Flags [P.], seq 28044:28208, ack 1, win 310, length 164
19:16:47.178565 IP lamp-s-1vcpu-1gb-tor1-01.ssh > 198.96.85.21.63313: Flags [P.], seq 28208:28372, ack 1, win 310, length 164
19:16:47.178669 IP lamp-s-1vcpu-1gb-tor1-01.ssh > 198.96.85.21.63313: Flags [P.], seq 28372:28536, ack 1, win 310, length 164
19:16:47.178771 IP lamp-s-1vcpu-1gb-tor1-01.ssh > 198.96.85.21.63313: Flags [P.], seq 28536:28700, ack 1, win 310, length 164
19:16:47.178874 IP lamp-s-1vcpu-1gb-tor1-01.ssh > 198.96.85.21.63313: Flags [P.], seq 28700:28864, ack 1, win 310, length 164
19:16:47.178976 IP lamp-s-1vcpu-1gb-tor1-01.ssh > 198.96.85.21.63313: Flags [P.], seq 28864:29028, ack 1, win 310, length 164
19:16:47.179081 IP lamp-s-1vcpu-1gb-tor1-01.ssh > 198.96.85.21.63313: Flags [P.], seq 29028:29192, ack 1, win 310, length 164
19:16:47.179184 IP lamp-s-1vcpu-1gb-tor1-01.ssh > 198.96.85.21.63313: Flags [P.], seq 29192:29356, ack 1, win 310, length 164
19:16:47.179287 IP lamp-s-1vcpu-1gb-tor1-01.ssh > 198.96.85.21.63313: Flags [P.], seq 29356:29520, ack 1, win 310, length 164
19:16:47.179389 IP lamp-s-1vcpu-1gb-tor1-01.ssh > 198.96.85.21.63313: Flags [P.], seq 29520:29684, ack 1, win 310, length 164
19:16:47.179492 IP lamp-s-1vcpu-1gb-tor1-01.ssh > 198.96.85.21.63313: Flags [P.], seq 29684:29848, ack 1, win 310, length 164
19:16:47.179595 IP lamp-s-1vcpu-1gb-tor1-01.ssh > 198.96.85.21.63313: Flags [P.], seq 29848:30012, ack 1, win 310, length 164
19:16:47.179697 IP lamp-s-1vcpu-1gb-tor1-01.ssh > 198.96.85.21.63313: Flags [P.], seq 30012:30176, ack 1, win 310, length 164
19:16:47.179799 IP lamp-s-1vcpu-1gb-tor1-01.ssh > 198.96.85.21.63313: Flags [P.], seq 30176:30340, ack 1, win 310, length 164
19:16:47.179933 IP lamp-s-1vcpu-1gb-tor1-01.ssh > 198.96.85.21.63313: Flags [P.], seq 30340:30504, ack 1, win 310, length 164
19:16:47.180040 IP lamp-s-1vcpu-1gb-tor1-01.ssh > 198.96.85.21.63313: Flags [P.], seq 30504:30668, ack 1, win 310, length 164
19:16:47.180146 IP lamp-s-1vcpu-1gb-tor1-01.ssh > 198.96.85.21.63313: Flags [P.], seq 30668:30832, ack 1, win 310, length 164
19:16:47.180249 IP lamp-s-1vcpu-1gb-tor1-01.ssh > 198.96.85.21.63313: Flags [P.], seq 30832:30996, ack 1, win 310, length 164
19:16:47.180352 IP lamp-s-1vcpu-1gb-tor1-01.ssh > 198.96.85.21.63313: Flags [P.], seq 30996:31160, ack 1, win 310, length 164
19:16:47.180455 IP lamp-s-1vcpu-1gb-tor1-01.ssh > 198.96.85.21.63313: Flags [P.], seq 31160:31324, ack 1, win 310, length 164
19:16:47.180557 IP lamp-s-1vcpu-1gb-tor1-01.ssh > 198.96.85.21.63313: Flags [P.], seq 31324:31488, ack 1, win 310, length 164
19:16:47.180659 IP lamp-s-1vcpu-1gb-tor1-01.ssh > 198.96.85.21.63313: Flags [P.], seq 31488:31652, ack 1, win 310, length 164
19:16:47.180762 IP lamp-s-1vcpu-1gb-tor1-01.ssh > 198.96.85.21.63313: Flags [P.], seq 31652:31816, ack 1, win 310, length 164
19:16:47.180866 IP lamp-s-1vcpu-1gb-tor1-01.ssh > 198.96.85.21.63313: Flags [P.], seq 31816:31980, ack 1, win 310, length 164
19:16:47.180969 IP lamp-s-1vcpu-1gb-tor1-01.ssh > 198.96.85.21.63313: Flags [P.], seq 31980:32144, ack 1, win 310, length 164
19:16:47.181071 IP lamp-s-1vcpu-1gb-tor1-01.ssh > 198.96.85.21.63313: Flags [P.], seq 32144:32308, ack 1, win 310, length 164
19:16:47.181177 IP lamp-s-1vcpu-1gb-tor1-01.ssh > 198.96.85.21.63313: Flags [P.], seq 32308:32472, ack 1, win 310, length 164
19:16:47.181280 IP lamp-s-1vcpu-1gb-tor1-01.ssh > 198.96.85.21.63313: Flags [P.], seq 32472:32636, ack 1, win 310, length 164
19:16:47.181383 IP lamp-s-1vcpu-1gb-tor1-01.ssh > 198.96.85.21.63313: Flags [P.], seq 32636:32800, ack 1, win 310, length 164
19:16:47.181486 IP lamp-s-1vcpu-1gb-tor1-01.ssh > 198.96.85.21.63313: Flags [P.], seq 32800:32964, ack 1, win 310, length 164
19:16:47.181589 IP lamp-s-1vcpu-1gb-tor1-01.ssh > 198.96.85.21.63313: Flags [P.], seq 32964:33128, ack 1, win 310, length 164
19:16:47.181698 IP lamp-s-1vcpu-1gb-tor1-01.ssh > 198.96.85.21.63313: Flags [P.], seq 33128:33292, ack 1, win 310, length 164
19:16:47.181803 IP lamp-s-1vcpu-1gb-tor1-01.ssh > 198.96.85.21.63313: Flags [P.], seq 33292:33456, ack 1, win 310, length 164
19:16:47.181933 IP lamp-s-1vcpu-1gb-tor1-01.ssh > 198.96.85.21.63313: Flags [P.], seq 33456:33620, ack 1, win 310, length 164
19:16:47.182043 IP lamp-s-1vcpu-1gb-tor1-01.ssh > 198.96.85.21.63313: Flags [P.], seq 33620:33784, ack 1, win 310, length 164
19:16:47.182154 IP lamp-s-1vcpu-1gb-tor1-01.ssh > 198.96.85.21.63313: Flags [P.], seq 33784:33948, ack 1, win 310, length 164
19:16:47.182258 IP lamp-s-1vcpu-1gb-tor1-01.ssh > 198.96.85.21.63313: Flags [P.], seq 33948:34112, ack 1, win 310, length 164
19:16:47.182365 IP lamp-s-1vcpu-1gb-tor1-01.ssh > 198.96.85.21.63313: Flags [P.], seq 34112:34276, ack 1, win 310, length 164
19:16:47.182470 IP lamp-s-1vcpu-1gb-tor1-01.ssh > 198.96.85.21.63313: Flags [P.], seq 34276:34440, ack 1, win 310, length 164
19:16:47.182576 IP lamp-s-1vcpu-1gb-tor1-01.ssh > 198.96.85.21.63313: Flags [P.], seq 34440:34604, ack 1, win 310, length 164
19:16:47.183068 IP lamp-s-1vcpu-1gb-tor1-01.ssh > 198.96.85.21.63313: Flags [P.], seq 34604:34768, ack 1, win 310, length 164
19:16:47.183178 IP lamp-s-1vcpu-1gb-tor1-01.ssh > 198.96.85.21.63313: Flags [P.], seq 34768:34932, ack 1, win 310, length 164
19:16:47.183288 IP lamp-s-1vcpu-1gb-tor1-01.ssh > 198.96.85.21.63313: Flags [P.], seq 34932:35096, ack 1, win 310, length 164
19:16:47.183392 IP lamp-s-1vcpu-1gb-tor1-01.ssh > 198.96.85.21.63313: Flags [P.], seq 35096:35260, ack 1, win 310, length 164
19:16:47.183494 IP lamp-s-1vcpu-1gb-tor1-01.ssh > 198.96.85.21.63313: Flags [P.], seq 35260:35424, ack 1, win 310, length 164
19:16:47.183597 IP lamp-s-1vcpu-1gb-tor1-01.ssh > 198.96.85.21.63313: Flags [P.], seq 35424:35588, ack 1, win 310, length 164
19:16:47.183700 IP lamp-s-1vcpu-1gb-tor1-01.ssh > 198.96.85.21.63313: Flags [P.], seq 35588:35752, ack 1, win 310, length 164
19:16:47.183805 IP lamp-s-1vcpu-1gb-tor1-01.ssh > 198.96.85.21.63313: Flags [P.], seq 35752:35916, ack 1, win 310, length 164
19:16:47.183931 IP lamp-s-1vcpu-1gb-tor1-01.ssh > 198.96.85.21.63313: Flags [P.], seq 35916:36080, ack 1, win 310, length 164
19:16:47.184040 IP lamp-s-1vcpu-1gb-tor1-01.ssh > 198.96.85.21.63313: Flags [P.], seq 36080:36244, ack 1, win 310, length 164
19:16:47.184147 IP lamp-s-1vcpu-1gb-tor1-01.ssh > 198.96.85.21.63313: Flags [P.], seq 36244:36408, ack 1, win 310, length 164
19:16:47.184252 IP lamp-s-1vcpu-1gb-tor1-01.ssh > 198.96.85.21.63313: Flags [P.], seq 36408:36572, ack 1, win 310, length 164
19:16:47.184355 IP lamp-s-1vcpu-1gb-tor1-01.ssh > 198.96.85.21.63313: Flags [P.], seq 36572:36736, ack 1, win 310, length 164
19:16:47.184458 IP lamp-s-1vcpu-1gb-tor1-01.ssh > 198.96.85.21.63313: Flags [P.], seq 36736:36900, ack 1, win 310, length 164
19:16:47.184561 IP lamp-s-1vcpu-1gb-tor1-01.ssh > 198.96.85.21.63313: Flags [P.], seq 36900:37064, ack 1, win 310, length 164
19:16:47.184666 IP lamp-s-1vcpu-1gb-tor1-01.ssh > 198.96.85.21.63313: Flags [P.], seq 37064:37228, ack 1, win 310, length 164
19:16:47.184770 IP lamp-s-1vcpu-1gb-tor1-01.ssh > 198.96.85.21.63313: Flags [P.], seq 37228:37392, ack 1, win 310, length 164
19:16:47.184872 IP lamp-s-1vcpu-1gb-tor1-01.ssh > 198.96.85.21.63313: Flags [P.], seq 37392:37556, ack 1, win 310, length 164
19:16:47.184976 IP lamp-s-1vcpu-1gb-tor1-01.ssh > 198.96.85.21.63313: Flags [P.], seq 37556:37720, ack 1, win 310, length 164
19:16:47.185078 IP lamp-s-1vcpu-1gb-tor1-01.ssh > 198.96.85.21.63313: Flags [P.], seq 37720:37884, ack 1, win 310, length 164
19:16:47.185181 IP lamp-s-1vcpu-1gb-tor1-01.ssh > 198.96.85.21.63313: Flags [P.], seq 37884:38048, ack 1, win 310, length 164
19:16:47.185282 IP lamp-s-1vcpu-1gb-tor1-01.ssh > 198.96.85.21.63313: Flags [P.], seq 38048:38212, ack 1, win 310, length 164
19:16:47.185407 IP lamp-s-1vcpu-1gb-tor1-01.ssh > 198.96.85.21.63313: Flags [P.], seq 38212:38376, ack 1, win 310, length 164
19:16:47.185540 IP lamp-s-1vcpu-1gb-tor1-01.ssh > 198.96.85.21.63313: Flags [P.], seq 38376:38540, ack 1, win 310, length 164
19:16:47.185573 IP 198.96.85.21.63313 > lamp-s-1vcpu-1gb-tor1-01.ssh: Flags [.], ack 30668, win 512, length 0
19:16:47.185730 IP lamp-s-1vcpu-1gb-tor1-01.ssh > 198.96.85.21.63313: Flags [P.], seq 38540:38816, ack 1, win 310, length 276
19:16:47.185809 IP 198.96.85.21.63313 > lamp-s-1vcpu-1gb-tor1-01.ssh: Flags [.], ack 34604, win 512, length 0
19:16:47.185967 IP lamp-s-1vcpu-1gb-tor1-01.ssh > 198.96.85.21.63313: Flags [P.], seq 38816:39092, ack 1, win 310, length 276
19:16:47.186080 IP lamp-s-1vcpu-1gb-tor1-01.ssh > 198.96.85.21.63313: Flags [P.], seq 39092:39256, ack 1, win 310, length 164
19:16:47.186185 IP lamp-s-1vcpu-1gb-tor1-01.ssh > 198.96.85.21.63313: Flags [P.], seq 39256:39420, ack 1, win 310, length 164
19:16:47.186287 IP lamp-s-1vcpu-1gb-tor1-01.ssh > 198.96.85.21.63313: Flags [P.], seq 39420:39584, ack 1, win 310, length 164
19:16:47.186391 IP lamp-s-1vcpu-1gb-tor1-01.ssh > 198.96.85.21.63313: Flags [P.], seq 39584:39748, ack 1, win 310, length 164
19:16:47.186565 IP lamp-s-1vcpu-1gb-tor1-01.ssh > 198.96.85.21.63313: Flags [P.], seq 39748:39912, ack 1, win 310, length 164
19:16:47.186757 IP lamp-s-1vcpu-1gb-tor1-01.ssh > 198.96.85.21.63313: Flags [P.], seq 39912:40076, ack 1, win 310, length 164
19:16:47.186887 IP lamp-s-1vcpu-1gb-tor1-01.ssh > 198.96.85.21.63313: Flags [P.], seq 40076:40240, ack 1, win 310, length 164
19:16:47.186997 IP lamp-s-1vcpu-1gb-tor1-01.ssh > 198.96.85.21.63313: Flags [P.], seq 40240:40404, ack 1, win 310, length 164
19:16:47.187103 IP lamp-s-1vcpu-1gb-tor1-01.ssh > 198.96.85.21.63313: Flags [P.], seq 40404:40568, ack 1, win 310, length 164
19:16:47.187206 IP lamp-s-1vcpu-1gb-tor1-01.ssh > 198.96.85.21.63313: Flags [P.], seq 40568:40732, ack 1, win 310, length 164
19:16:47.187310 IP lamp-s-1vcpu-1gb-tor1-01.ssh > 198.96.85.21.63313: Flags [P.], seq 40732:40896, ack 1, win 310, length 164
19:16:47.187414 IP lamp-s-1vcpu-1gb-tor1-01.ssh > 198.96.85.21.63313: Flags [P.], seq 40896:41060, ack 1, win 310, length 164
19:16:47.187518 IP lamp-s-1vcpu-1gb-tor1-01.ssh > 198.96.85.21.63313: Flags [P.], seq 41060:41224, ack 1, win 310, length 164
19:16:47.187621 IP lamp-s-1vcpu-1gb-tor1-01.ssh > 198.96.85.21.63313: Flags [P.], seq 41224:41388, ack 1, win 310, length 164
19:16:47.187725 IP lamp-s-1vcpu-1gb-tor1-01.ssh > 198.96.85.21.63313: Flags [P.], seq 41388:41552, ack 1, win 310, length 164
19:16:47.187829 IP lamp-s-1vcpu-1gb-tor1-01.ssh > 198.96.85.21.63313: Flags [P.], seq 41552:41716, ack 1, win 310, length 164
19:16:47.187961 IP lamp-s-1vcpu-1gb-tor1-01.ssh > 198.96.85.21.63313: Flags [P.], seq 41716:41880, ack 1, win 310, length 164
19:16:47.188077 IP lamp-s-1vcpu-1gb-tor1-01.ssh > 198.96.85.21.63313: Flags [P.], seq 41880:42044, ack 1, win 310, length 164
19:16:47.188187 IP lamp-s-1vcpu-1gb-tor1-01.ssh > 198.96.85.21.63313: Flags [P.], seq 42044:42208, ack 1, win 310, length 164
19:16:47.188291 IP lamp-s-1vcpu-1gb-tor1-01.ssh > 198.96.85.21.63313: Flags [P.], seq 42208:42372, ack 1, win 310, length 164
19:16:47.188395 IP lamp-s-1vcpu-1gb-tor1-01.ssh > 198.96.85.21.63313: Flags [P.], seq 42372:42536, ack 1, win 310, length 164
19:16:47.188499 IP lamp-s-1vcpu-1gb-tor1-01.ssh > 198.96.85.21.63313: Flags [P.], seq 42536:42700, ack 1, win 310, length 164
19:16:47.188603 IP lamp-s-1vcpu-1gb-tor1-01.ssh > 198.96.85.21.63313: Flags [P.], seq 42700:42864, ack 1, win 310, length 164
19:16:47.188707 IP lamp-s-1vcpu-1gb-tor1-01.ssh > 198.96.85.21.63313: Flags [P.], seq 42864:43028, ack 1, win 310, length 164
19:16:47.188811 IP lamp-s-1vcpu-1gb-tor1-01.ssh > 198.96.85.21.63313: Flags [P.], seq 43028:43192, ack 1, win 310, length 164
19:16:47.188930 IP lamp-s-1vcpu-1gb-tor1-01.ssh > 198.96.85.21.63313: Flags [P.], seq 43192:43356, ack 1, win 310, length 164
19:16:47.189034 IP lamp-s-1vcpu-1gb-tor1-01.ssh > 198.96.85.21.63313: Flags [P.], seq 43356:43520, ack 1, win 310, length 164
19:16:47.189139 IP lamp-s-1vcpu-1gb-tor1-01.ssh > 198.96.85.21.63313: Flags [P.], seq 43520:43684, ack 1, win 310, length 164
19:16:47.189243 IP lamp-s-1vcpu-1gb-tor1-01.ssh > 198.96.85.21.63313: Flags [P.], seq 43684:43848, ack 1, win 310, length 164
19:16:47.189347 IP lamp-s-1vcpu-1gb-tor1-01.ssh > 198.96.85.21.63313: Flags [P.], seq 43848:44012, ack 1, win 310, length 164
19:16:47.189451 IP lamp-s-1vcpu-1gb-tor1-01.ssh > 198.96.85.21.63313: Flags [P.], seq 44012:44176, ack 1, win 310, length 164
19:16:47.189554 IP lamp-s-1vcpu-1gb-tor1-01.ssh > 198.96.85.21.63313: Flags [P.], seq 44176:44340, ack 1, win 310, length 164
19:16:47.189659 IP lamp-s-1vcpu-1gb-tor1-01.ssh > 198.96.85.21.63313: Flags [P.], seq 44340:44504, ack 1, win 310, length 164
19:16:47.189762 IP lamp-s-1vcpu-1gb-tor1-01.ssh > 198.96.85.21.63313: Flags [P.], seq 44504:44668, ack 1, win 310, length 164
19:16:47.189866 IP lamp-s-1vcpu-1gb-tor1-01.ssh > 198.96.85.21.63313: Flags [P.], seq 44668:44832, ack 1, win 310, length 164
19:16:47.190007 IP lamp-s-1vcpu-1gb-tor1-01.ssh > 198.96.85.21.63313: Flags [P.], seq 44832:44996, ack 1, win 310, length 164
19:16:47.190116 IP lamp-s-1vcpu-1gb-tor1-01.ssh > 198.96.85.21.63313: Flags [P.], seq 44996:45160, ack 1, win 310, length 164
19:16:47.190247 IP lamp-s-1vcpu-1gb-tor1-01.ssh > 198.96.85.21.63313: Flags [P.], seq 45160:45324, ack 1, win 310, length 164
19:16:47.190357 IP lamp-s-1vcpu-1gb-tor1-01.ssh > 198.96.85.21.63313: Flags [P.], seq 45324:45488, ack 1, win 310, length 164
19:16:47.190462 IP lamp-s-1vcpu-1gb-tor1-01.ssh > 198.96.85.21.63313: Flags [P.], seq 45488:45652, ack 1, win 310, length 164
19:16:47.190567 IP lamp-s-1vcpu-1gb-tor1-01.ssh > 198.96.85.21.63313: Flags [P.], seq 45652:45816, ack 1, win 310, length 164
19:16:47.190670 IP lamp-s-1vcpu-1gb-tor1-01.ssh > 198.96.85.21.63313: Flags [P.], seq 45816:45980, ack 1, win 310, length 164
19:16:47.190774 IP lamp-s-1vcpu-1gb-tor1-01.ssh > 198.96.85.21.63313: Flags [P.], seq 45980:46144, ack 1, win 310, length 164
19:16:47.190876 IP lamp-s-1vcpu-1gb-tor1-01.ssh > 198.96.85.21.63313: Flags [P.], seq 46144:46308, ack 1, win 310, length 164
19:16:47.190979 IP lamp-s-1vcpu-1gb-tor1-01.ssh > 198.96.85.21.63313: Flags [P.], seq 46308:46472, ack 1, win 310, length 164
19:16:47.191089 IP lamp-s-1vcpu-1gb-tor1-01.ssh > 198.96.85.21.63313: Flags [P.], seq 46472:46636, ack 1, win 310, length 164
19:16:47.191198 IP lamp-s-1vcpu-1gb-tor1-01.ssh > 198.96.85.21.63313: Flags [P.], seq 46636:46800, ack 1, win 310, length 164
19:16:47.191303 IP lamp-s-1vcpu-1gb-tor1-01.ssh > 198.96.85.21.63313: Flags [P.], seq 46800:46964, ack 1, win 310, length 164
19:16:47.191407 IP lamp-s-1vcpu-1gb-tor1-01.ssh > 198.96.85.21.63313: Flags [P.], seq 46964:47128, ack 1, win 310, length 164
19:16:47.191514 IP lamp-s-1vcpu-1gb-tor1-01.ssh > 198.96.85.21.63313: Flags [P.], seq 47128:47292, ack 1, win 310, length 164
19:16:47.191618 IP lamp-s-1vcpu-1gb-tor1-01.ssh > 198.96.85.21.63313: Flags [P.], seq 47292:47456, ack 1, win 310, length 164
19:16:47.191723 IP lamp-s-1vcpu-1gb-tor1-01.ssh > 198.96.85.21.63313: Flags [P.], seq 47456:47620, ack 1, win 310, length 164
19:16:47.191830 IP lamp-s-1vcpu-1gb-tor1-01.ssh > 198.96.85.21.63313: Flags [P.], seq 47620:47784, ack 1, win 310, length 164
19:16:47.191962 IP lamp-s-1vcpu-1gb-tor1-01.ssh > 198.96.85.21.63313: Flags [P.], seq 47784:47948, ack 1, win 310, length 164
19:16:47.192072 IP lamp-s-1vcpu-1gb-tor1-01.ssh > 198.96.85.21.63313: Flags [P.], seq 47948:48112, ack 1, win 310, length 164
19:16:47.192180 IP lamp-s-1vcpu-1gb-tor1-01.ssh > 198.96.85.21.63313: Flags [P.], seq 48112:48276, ack 1, win 310, length 164
19:16:47.192287 IP lamp-s-1vcpu-1gb-tor1-01.ssh > 198.96.85.21.63313: Flags [P.], seq 48276:48440, ack 1, win 310, length 164
19:16:47.192391 IP lamp-s-1vcpu-1gb-tor1-01.ssh > 198.96.85.21.63313: Flags [P.], seq 48440:48604, ack 1, win 310, length 164
19:16:47.192526 IP lamp-s-1vcpu-1gb-tor1-01.ssh > 198.96.85.21.63313: Flags [P.], seq 48604:48768, ack 1, win 310, length 164
19:16:47.192633 IP lamp-s-1vcpu-1gb-tor1-01.ssh > 198.96.85.21.63313: Flags [P.], seq 48768:48932, ack 1, win 310, length 164
19:16:47.192739 IP lamp-s-1vcpu-1gb-tor1-01.ssh > 198.96.85.21.63313: Flags [P.], seq 48932:49096, ack 1, win 310, length 164
19:16:47.192846 IP lamp-s-1vcpu-1gb-tor1-01.ssh > 198.96.85.21.63313: Flags [P.], seq 49096:49260, ack 1, win 310, length 164
19:16:47.192953 IP lamp-s-1vcpu-1gb-tor1-01.ssh > 198.96.85.21.63313: Flags [P.], seq 49260:49424, ack 1, win 310, length 164
19:16:47.193059 IP lamp-s-1vcpu-1gb-tor1-01.ssh > 198.96.85.21.63313: Flags [P.], seq 49424:49588, ack 1, win 310, length 164
19:16:47.193163 IP lamp-s-1vcpu-1gb-tor1-01.ssh > 198.96.85.21.63313: Flags [P.], seq 49588:49752, ack 1, win 310, length 164
19:16:47.193265 IP lamp-s-1vcpu-1gb-tor1-01.ssh > 198.96.85.21.63313: Flags [P.], seq 49752:49916, ack 1, win 310, length 164
19:16:47.193368 IP lamp-s-1vcpu-1gb-tor1-01.ssh > 198.96.85.21.63313: Flags [P.], seq 49916:50080, ack 1, win 310, length 164
19:16:47.193471 IP lamp-s-1vcpu-1gb-tor1-01.ssh > 198.96.85.21.63313: Flags [P.], seq 50080:50244, ack 1, win 310, length 164
19:16:47.193574 IP lamp-s-1vcpu-1gb-tor1-01.ssh > 198.96.85.21.63313: Flags [P.], seq 50244:50408, ack 1, win 310, length 164
19:16:47.193680 IP lamp-s-1vcpu-1gb-tor1-01.ssh > 198.96.85.21.63313: Flags [P.], seq 50408:50572, ack 1, win 310, length 164
19:16:47.193786 IP lamp-s-1vcpu-1gb-tor1-01.ssh > 198.96.85.21.63313: Flags [P.], seq 50572:50736, ack 1, win 310, length 164
19:16:47.193917 IP lamp-s-1vcpu-1gb-tor1-01.ssh > 198.96.85.21.63313: Flags [P.], seq 50736:50900, ack 1, win 310, length 164
19:16:47.194027 IP lamp-s-1vcpu-1gb-tor1-01.ssh > 198.96.85.21.63313: Flags [P.], seq 50900:51064, ack 1, win 310, length 164
19:16:47.194133 IP lamp-s-1vcpu-1gb-tor1-01.ssh > 198.96.85.21.63313: Flags [P.], seq 51064:51228, ack 1, win 310, length 164
19:16:47.194237 IP lamp-s-1vcpu-1gb-tor1-01.ssh > 198.96.85.21.63313: Flags [P.], seq 51228:51392, ack 1, win 310, length 164
19:16:47.194340 IP lamp-s-1vcpu-1gb-tor1-01.ssh > 198.96.85.21.63313: Flags [P.], seq 51392:51556, ack 1, win 310, length 164
19:16:47.194442 IP lamp-s-1vcpu-1gb-tor1-01.ssh > 198.96.85.21.63313: Flags [P.], seq 51556:51720, ack 1, win 310, length 164
19:16:47.194548 IP lamp-s-1vcpu-1gb-tor1-01.ssh > 198.96.85.21.63313: Flags [P.], seq 51720:51884, ack 1, win 310, length 164
19:16:47.194652 IP lamp-s-1vcpu-1gb-tor1-01.ssh > 198.96.85.21.63313: Flags [P.], seq 51884:52048, ack 1, win 310, length 164
19:16:47.194757 IP lamp-s-1vcpu-1gb-tor1-01.ssh > 198.96.85.21.63313: Flags [P.], seq 52048:52212, ack 1, win 310, length 164
